{
  "schema": "wellmanifest.report/manifest/v1",
  "id": "deepseek-v41-routing",
  "version": 1,
  "title": "DeepSeek V4.1 routing and backlog audit",
  "owner": "subactor/subllm",
  "kind": "analysis",
  "created": "2026-10-24",
  "updated": "2026-10-24",
  "review_after": "2026-10-25",
  "status": "final",
  "authority": "none",
  "document": {
    "path": "docs/analysis/deepseek-v41-routing.md",
    "index_path": "docs/README.md",
    "sha256": "7d55bc0fc60eca71e64558c3b9c831ee4a9bbef0d86ef8d92c814f1b4dcf66fb"
  },
  "scope": {
    "repositories": [
      "subactor/subllm"
    ],
    "subjects": [
      {
        "id": "subllm-source",
        "repository": "subactor/subllm",
        "revision": "a367cf701de4b7aa758f47029a9cdfe94ca7ed88"
      }
    ],
    "exclusions": [
      "No authenticated DeepSeek latency benchmark, fleet deployment or independent review claim."
    ]
  },
  "coverage": {
    "state": "complete",
    "unit": "previously open GitHub issues inspected",
    "expected": 9,
    "observed": 9
  },
  "assessment": "incomplete",
  "findings": [
    {
      "id": "task-dependent-cost",
      "kind": "fact",
      "text": "Cheapest endpoint depends on model snapshot and input/output/cache token mix.",
      "evidence_ids": [
        "alias",
        "snapshot",
        "quotes"
      ]
    },
    {
      "id": "unknown-latency",
      "kind": "fact",
      "text": "All recent latency and throughput fields in these observations were null.",
      "evidence_ids": [
        "alias",
        "snapshot"
      ]
    },
    {
      "id": "native-access",
      "kind": "fact",
      "text": "A bounded native DeepSeek request succeeded, while pinned Baidu calibration failed with HTTP403.",
      "evidence_ids": [
        "native-smoke",
        "provider-failure"
      ]
    }
  ],
  "evidence": [
    {
      "id": "alias",
      "kind": "observation",
      "subject_id": "subllm-source",
      "reference": "receipt:sha256:d6afe09e18bed3896e41eff1c60d59bf62612547c38a3128cea1d98aa2fa96f3",
      "sha256": "d6afe09e18bed3896e41eff1c60d59bf62612547c38a3128cea1d98aa2fa96f3"
    },
    {
      "id": "snapshot",
      "kind": "observation",
      "subject_id": "subllm-source",
      "reference": "receipt:sha256:4e7c1a4f39fd1cb59302d75565b590fd74fc4d64844bfcfb308a24a7513f31a6",
      "sha256": "4e7c1a4f39fd1cb59302d75565b590fd74fc4d64844bfcfb308a24a7513f31a6"
    },
    {
      "id": "quotes",
      "kind": "observation",
      "subject_id": "subllm-source",
      "reference": "receipt:sha256:178a14cfd9f9475ead295aaa2e49687783104c4055b67dad3b4fc1510c5e631c",
      "sha256": "178a14cfd9f9475ead295aaa2e49687783104c4055b67dad3b4fc1510c5e631c"
    },
    {
      "id": "quote-assertions",
      "kind": "test",
      "subject_id": "subllm-source",
      "reference": "receipt:sha256:4eec6312eaefd207543278bda73a4a80ac9383d64e5430983af1689f28e75d7a",
      "sha256": "4eec6312eaefd207543278bda73a4a80ac9383d64e5430983af1689f28e75d7a"
    },
    {
      "id": "redaction",
      "kind": "redaction",
      "subject_id": "subllm-source",
      "reference": "receipt:sha256:2b508c6b6717aa79b92968e34a9649ee33f08daf2b57c03654f716f991a601f4",
      "sha256": "2b508c6b6717aa79b92968e34a9649ee33f08daf2b57c03654f716f991a601f4"
    },
    {
      "id": "native-smoke",
      "kind": "observation",
      "subject_id": "subllm-source",
      "reference": "receipt:sha256:419ec6a76db7c07ef3935e4eb94693388943630d402e8b61852ff268a61e2576",
      "sha256": "419ec6a76db7c07ef3935e4eb94693388943630d402e8b61852ff268a61e2576"
    },
    {
      "id": "provider-failure",
      "kind": "observation",
      "subject_id": "subllm-source",
      "reference": "receipt:sha256:35b77240fc37e502a6baac12569251e3e6481c3d2e59a5bd5cfb5308606ed3f2",
      "sha256": "35b77240fc37e502a6baac12569251e3e6481c3d2e59a5bd5cfb5308606ed3f2"
    },
    {
      "id": "completed-docs-issue",
      "kind": "observation",
      "subject_id": "subllm-source",
      "reference": "receipt:sha256:cc26098f6edcc94907da8bdb699af043506cc8e2bdc4944faa72eea2528a8ea4",
      "sha256": "cc26098f6edcc94907da8bdb699af043506cc8e2bdc4944faa72eea2528a8ea4"
    }
  ],
  "checks": [
    {
      "name": "Public endpoint comparison",
      "subject_id": "subllm-source",
      "result": "PASS",
      "reason": "Observed exact-model public metadata and computed task-dependent text quotes.",
      "evidence_ids": [
        "quote-assertions"
      ]
    },
    {
      "name": "Authenticated DeepSeek TTFT",
      "subject_id": "subllm-source",
      "result": "NOT_RUN",
      "reason": "Native non-streaming request succeeded; pinned Baidu failed HTTP403. Streaming TTFT and repeated percentile calibration were not performed.",
      "evidence_ids": []
    }
  ],
  "limitations": [
    "Public inventory is distinct from account access and successful inference.",
    "Remaining consumer adoption criteria keep the backlog assessment incomplete."
  ],
  "next_actions": [
    {
      "description": "Measure same-snapshot streaming TTFT, throughput, errors and billed tokens with a capped benchmark.",
      "owner": "subactor/subllm",
      "resume_when": "The chosen endpoint is permitted, native health permits requests and issue134 has an accepted bounded streaming measurement plan."
    }
  ],
  "redaction": {
    "state": "checked",
    "evidence_ids": [
      "redaction"
    ]
  },
  "publication": {
    "state": "local",
    "revision": null,
    "pull_request": null,
    "evidence_ids": []
  }
}
