{
  "schema": "wellmanifest.report/manifest/v1",
  "id": "task-model-routing",
  "version": 2,
  "title": "Task model routing, full GLM baseline and response quality",
  "owner": "subactor/subllm",
  "kind": "analysis",
  "created": "2026-10-30",
  "updated": "2026-10-30",
  "review_after": "2026-11-06",
  "status": "final",
  "authority": "none",
  "document": {
    "path": "docs/analysis/task-model-routing.md",
    "index_path": "docs/README.md",
    "sha256": "2cfe24e22dc2816f754c04c064580f251fefcdb8d9aa8206babfc6986676f23d"
  },
  "scope": {
    "repositories": [
      "subactor/subllm"
    ],
    "subjects": [
      {
        "id": "subllm-source",
        "repository": "subactor/subllm",
        "revision": "664734a09a52dbc2c41902ec372aa3f7999ea08e"
      },
      {
        "id": "quality-source",
        "repository": "subactor/subllm",
        "revision": "024b4fe5dd8bfd474ef09f3f7f663c59fa7a9bd1"
      }
    ],
    "exclusions": [
      "No production deployment or broad task-quality benchmark is claimed."
    ]
  },
  "coverage": {
    "state": "complete",
    "unit": "applications in operator audit",
    "expected": 4,
    "observed": 4
  },
  "assessment": "incomplete",
  "findings": [
    {
      "id": "shared-full-default",
      "kind": "fact",
      "text": "Bounded tasks shared a full GLM 5.3 default; explicitly modelled candidates ignore a changed provider default_model.",
      "evidence_ids": [
        "policy-source"
      ]
    },
    {
      "id": "direct-flash-works",
      "kind": "fact",
      "text": "Both direct ZAI models returned semantically correct JSON on all three paired synthetic tasks. Flash mean latency was 5.281s versus 4.824s for full GLM at low effort.",
      "evidence_ids": [
        "canaries"
      ]
    },
    {
      "id": "quota-improvement",
      "kind": "hypothesis",
      "text": "Direct Flash can reduce Coding Plan use for bounded roles; the documented multipliers applied to observed tokens imply about 58% fewer points in this sample.",
      "evidence_ids": [
        "canaries"
      ]
    },
    {
      "id": "production-validation",
      "kind": "recommendation",
      "text": "Validate large-context assessment quality and task success after independent publication and deployment.",
      "evidence_ids": [
        "usage-summary"
      ]
    },
    {
      "id": "full-baseline-restored",
      "kind": "fact",
      "text": "Reviewed ticket-179 restores full GLM-5.3 first with low reasoning for bounded roles; Flash is a later candidate. Existing paired canaries do not establish production equivalence.",
      "evidence_ids": [
        "quality-policy",
        "canaries"
      ]
    },
    {
      "id": "quality-before-success",
      "kind": "fact",
      "text": "Structural and task-owned predicate acceptance run before success. Model-scoped rejection retains usage and allows permitted failover; broken predicates abort. This is not arbitrary semantic judging or full JSON Schema validation.",
      "evidence_ids": [
        "quality-gate",
        "quality-failover"
      ]
    }
  ],
  "evidence": [
    {
      "id": "canaries",
      "kind": "test",
      "subject_id": "subllm-source",
      "reference": "receipt:sha256:f763d1265a263d1e47b2f89852e657162a3ac0e8f4becdfa3a1b544df4363490",
      "sha256": "f763d1265a263d1e47b2f89852e657162a3ac0e8f4becdfa3a1b544df4363490"
    },
    {
      "id": "usage-summary",
      "kind": "observation",
      "subject_id": "subllm-source",
      "reference": "receipt:sha256:e59e3c0c3850d6090cf24f8b6466b46eb204d49c6b17768e5e07f1562b51829c",
      "sha256": "e59e3c0c3850d6090cf24f8b6466b46eb204d49c6b17768e5e07f1562b51829c"
    },
    {
      "id": "redaction",
      "kind": "redaction",
      "subject_id": "subllm-source",
      "reference": "receipt:sha256:9990ee9f8e5d174ccb8af6bb8095bd9cf6f7d1cd6a497c2986f5d526343f5a51",
      "sha256": "9990ee9f8e5d174ccb8af6bb8095bd9cf6f7d1cd6a497c2986f5d526343f5a51"
    },
    {
      "id": "policy-source",
      "kind": "source",
      "subject_id": "subllm-source",
      "reference": "repo://subactor/subllm@664734a09a52dbc2c41902ec372aa3f7999ea08e/src/subllm/policy.py",
      "sha256": "b009fc9bea9595fb8b9ebdfe45a82cb1f4dcd3e1834519dc0f8b816ea23c2a36"
    },
    {
      "id": "quality-policy",
      "kind": "source",
      "subject_id": "quality-source",
      "reference": "repo://subactor/subllm@024b4fe5dd8bfd474ef09f3f7f663c59fa7a9bd1/src/subllm/policy.py",
      "sha256": "fe300cb11b66d10fc6df95b3348d5a51ff0feb06eb15dd0eea154dec326bae84"
    },
    {
      "id": "quality-gate",
      "kind": "source",
      "subject_id": "quality-source",
      "reference": "repo://subactor/subllm@024b4fe5dd8bfd474ef09f3f7f663c59fa7a9bd1/src/subllm/quality.py",
      "sha256": "5cb9f1f78c8538f20873adf17d3b0148bffc05ed467d50b6da95a71713b5e409"
    },
    {
      "id": "quality-failover",
      "kind": "source",
      "subject_id": "quality-source",
      "reference": "repo://subactor/subllm@024b4fe5dd8bfd474ef09f3f7f663c59fa7a9bd1/src/subllm/client_routes.py",
      "sha256": "6508f43176bc709f7c34bb4d3c577f01db69c1d0efe29e1a18dddb0a74cc49e9"
    }
  ],
  "checks": [
    {
      "name": "Paired synthetic task correctness",
      "subject_id": "subllm-source",
      "result": "PASS",
      "reason": "Task IDs, action, lane, IDE and install=false checked for three examples per model.",
      "evidence_ids": [
        "canaries"
      ]
    },
    {
      "name": "Production quality and deployed candidate",
      "subject_id": "subllm-source",
      "result": "NOT_RUN",
      "reason": "Representative production replay and all-consumer rollout remain unverified; reviewed quality source is ticket-179, independently merged through PR 183.",
      "evidence_ids": []
    }
  ],
  "limitations": [
    "Three tiny canaries cannot establish production quality or latency percentiles.",
    "The larger Supervisor context has not been replayed.",
    "Provider success does not establish task success; historical attempts used different contexts.",
    "Library structural acceptance does not establish semantic correctness; consumer predicates must enforce their declared schema and task criteria."
  ],
  "next_actions": [
    {
      "description": "Retain the full baseline; forward response formats and task-owned predicates, then replay representative contexts before choosing Flash defaults.",
      "owner": "subactor/subllm",
      "resume_when": "Consumers supply exact acceptance criteria and comparable task-quality evidence."
    }
  ],
  "redaction": {
    "state": "checked",
    "evidence_ids": [
      "redaction"
    ]
  },
  "publication": {
    "state": "local",
    "revision": null,
    "pull_request": null,
    "evidence_ids": []
  }
}
